{
  "schema_version": 1,
  "coordinate_system": "GCJ-02",
  "scene_revision": 1,
  "view_origin_e6": [
    36675246,
    117128578
  ],
  "radius_m": 650,
  "roads": [
    {
      "osm_way_id": 1296826090,
      "class": "service",
      "points_e6": [
        [
          36674145,
          117128489
        ],
        [
          36674773,
          117128056
        ],
        [
          36674825,
          117127981
        ],
        [
          36674825,
          117127858
        ],
        [
          36674295,
          117126687
        ]
      ]
    },
    {
      "osm_way_id": 1222956211,
      "class": "secondary",
      "points_e6": [
        [
          36673505,
          117127268
        ],
        [
          36673510,
          117127480
        ],
        [
          36674861,
          117130296
        ]
      ]
    },
    {
      "osm_way_id": 136622039,
      "class": "secondary",
      "points_e6": [
        [
          36673446,
          117127165
        ],
        [
          36673103,
          117126323
        ],
        [
          36673037,
          117125978
        ],
        [
          36673027,
          117124713
        ],
        [
          36672605,
          117121462
        ]
      ]
    },
    {
      "osm_way_id": 562686627,
      "class": "secondary",
      "points_e6": [
        [
          36671563,
          117131317
        ],
        [
          36671678,
          117131259
        ],
        [
          36672096,
          117131206
        ],
        [
          36672471,
          117131240
        ],
        [
          36672841,
          117131339
        ],
        [
          36673021,
          117131353
        ],
        [
          36673465,
          117131278
        ],
        [
          36673775,
          117131093
        ],
        [
          36674861,
          117130296
        ]
      ]
    },
    {
      "osm_way_id": 261478935,
      "class": "service",
      "points_e6": [
        [
          36672726,
          117128586
        ],
        [
          36673084,
          117128456
        ],
        [
          36673466,
          117128516
        ],
        [
          36673424,
          117128876
        ],
        [
          36673499,
          117128954
        ],
        [
          36673605,
          117128957
        ],
        [
          36673754,
          117128751
        ],
        [
          36673782,
          117128611
        ],
        [
          36673978,
          117128802
        ],
        [
          36674147,
          117129105
        ],
        [
          36674237,
          117129464
        ],
        [
          36673815,
          117129606
        ],
        [
          36673822,
          117129790
        ],
        [
          36674223,
          117129907
        ],
        [
          36674172,
          117130171
        ],
        [
          36673943,
          117130582
        ],
        [
          36673840,
          117130626
        ],
        [
          36673591,
          117130395
        ],
        [
          36673435,
          117130422
        ],
        [
          36673411,
          117130928
        ],
        [
          36673022,
          117130927
        ],
        [
          36672678,
          117130762
        ]
      ]
    },
    {
      "osm_way_id": 261478934,
      "class": "service",
      "points_e6": [
        [
          36672539,
          117131154
        ],
        [
          36672847,
          117130313
        ],
        [
          36672783,
          117130008
        ],
        [
          36672715,
          117129850
        ],
        [
          36672222,
          117129842
        ],
        [
          36672282,
          117129281
        ],
        [
          36672445,
          117128949
        ],
        [
          36672855,
          117129217
        ],
        [
          36672909,
          117129129
        ],
        [
          36672726,
          117128586
        ],
        [
          36672565,
          117128239
        ]
      ]
    },
    {
      "osm_way_id": 1339796791,
      "class": "service",
      "points_e6": [
        [
          36675962,
          117127793
        ],
        [
          36675244,
          117128363
        ],
        [
          36674393,
          117126615
        ]
      ]
    },
    {
      "osm_way_id": 188224840,
      "class": "residential",
      "points_e6": [
        [
          36673027,
          117124713
        ],
        [
          36671680,
          117124758
        ],
        [
          36671045,
          117124934
        ],
        [
          36669321,
          117125795
        ],
        [
          36669208,
          117125877
        ],
        [
          36669032,
          117126167
        ],
        [
          36668885,
          117126512
        ],
        [
          36668523,
          117127833
        ]
      ]
    },
    {
      "osm_way_id": 910664044,
      "class": "residential",
      "points_e6": [
        [
          36673041,
          117125681
        ],
        [
          36672784,
          117125689
        ],
        [
          36672527,
          117125755
        ],
        [
          36672080,
          117125922
        ],
        [
          36671834,
          117126141
        ],
        [
          36671611,
          117126223
        ],
        [
          36670617,
          117126434
        ],
        [
          36670133,
          117126693
        ],
        [
          36669915,
          117126864
        ],
        [
          36669643,
          117127152
        ],
        [
          36669460,
          117127586
        ],
        [
          36669256,
          117128187
        ]
      ]
    },
    {
      "osm_way_id": 910896680,
      "class": "service",
      "points_e6": [
        [
          36671962,
          117128637
        ],
        [
          36672425,
          117127821
        ],
        [
          36672340,
          117127643
        ],
        [
          36672239,
          117127528
        ],
        [
          36672153,
          117127556
        ]
      ]
    },
    {
      "osm_way_id": 915085979,
      "class": "service",
      "points_e6": [
        [
          36671776,
          117129627
        ],
        [
          36671661,
          117129572
        ],
        [
          36671544,
          117129577
        ],
        [
          36671270,
          117130871
        ],
        [
          36671177,
          117131054
        ],
        [
          36670782,
          117131421
        ],
        [
          36670873,
          117131580
        ]
      ]
    },
    {
      "osm_way_id": 914735347,
      "class": "residential",
      "points_e6": [
        [
          36670823,
          117128947
        ],
        [
          36670423,
          117130215
        ],
        [
          36670263,
          117130157
        ],
        [
          36670168,
          117130209
        ],
        [
          36669949,
          117129778
        ],
        [
          36669788,
          117129550
        ],
        [
          36669644,
          117129463
        ],
        [
          36669077,
          117129454
        ],
        [
          36668598,
          117129811
        ],
        [
          36668280,
          117131231
        ],
        [
          36668373,
          117131592
        ],
        [
          36668610,
          117131868
        ],
        [
          36668958,
          117131963
        ],
        [
          36669255,
          117131943
        ],
        [
          36670111,
          117131076
        ],
        [
          36670164,
          117130930
        ]
      ]
    },
    {
      "osm_way_id": 914735349,
      "class": "service",
      "points_e6": [
        [
          36670711,
          117130424
        ],
        [
          36670891,
          117130510
        ],
        [
          36671131,
          117129723
        ],
        [
          36670951,
          117129638
        ],
        [
          36670711,
          117130424
        ],
        [
          36670474,
          117130311
        ],
        [
          36670454,
          117130234
        ]
      ]
    },
    {
      "osm_way_id": 977925493,
      "class": "service",
      "points_e6": [
        [
          36669723,
          117127053
        ],
        [
          36669817,
          117127288
        ],
        [
          36669855,
          117127561
        ],
        [
          36670137,
          117127511
        ],
        [
          36670164,
          117127957
        ],
        [
          36670346,
          117127922
        ],
        [
          36670339,
          117127825
        ],
        [
          36670445,
          117127803
        ],
        [
          36670376,
          117127331
        ],
        [
          36670201,
          117127378
        ],
        [
          36670093,
          117127019
        ],
        [
          36670006,
          117126850
        ]
      ]
    },
    {
      "osm_way_id": 915078291,
      "class": "service",
      "points_e6": [
        [
          36668943,
          117129553
        ],
        [
          36668906,
          117129506
        ],
        [
          36668566,
          117129337
        ],
        [
          36668620,
          117129165
        ],
        [
          36668677,
          117129192
        ],
        [
          36668929,
          117128431
        ],
        [
          36668785,
          117128349
        ],
        [
          36668529,
          117129118
        ],
        [
          36668620,
          117129165
        ]
      ]
    },
    {
      "osm_way_id": 790389632,
      "class": "secondary",
      "points_e6": [
        [
          36668523,
          117127833
        ],
        [